{
  "schema_version": "accord-challenge-v0.3",
  "challenge_id": "ACCORD-C01-self-legitimation",
  "claim": {
    "id": "ACCORD-C01",
    "revision": "v0.2",
    "falsification_id": "C01-F1"
  },
  "attack": {
    "class": "EPISTEMIC_PROMOTION",
    "summary": "Actor-controlled assertion appears sufficient for a positive authority decision."
  },
  "scope_position": {
    "position": "SUBMITTER_ASSERTED_IN_SCOPE",
    "justification": "The submitter asserts that the example targets the published falsification property."
  },
  "subject": {
    "boundary": "example-boundary"
  },
  "observations": [
    {
      "id": "obs-1",
      "statement": "Actor-controlled assertion appears sufficient for a positive authority decision.",
      "evidence_refs": [
        "ev-1"
      ]
    }
  ],
  "evidence": [
    {
      "id": "ev-1",
      "kind": "SELF_CONTAINED",
      "description": "Illustrative submitter-provided evidence description for format testing."
    }
  ],
  "counterexample": {
    "reasoning": "The evidence is alleged to show no independent authority basis beyond the actor assertion."
  },
  "notes": "Illustrative fixture. Mechanical well-formedness is not substantive adjudication."
}
