{
  "schema_version": "accord-challenge-v0.3",
  "challenge_id": "ACCORD-C04-result-dependent-admission",
  "claim": {
    "id": "ACCORD-C04",
    "revision": "v0.2",
    "falsification_id": "C04-F5"
  },
  "attack": {
    "class": "EVIDENCE_INCONSISTENCY",
    "summary": "Material evidence is alleged to be excluded because it weakens the desired historical result."
  },
  "scope_position": {
    "position": "SUBMITTER_ASSERTED_IN_SCOPE",
    "justification": "The submitter asserts that the example targets the published falsification property."
  },
  "subject": {
    "historical_subject": "example-history-selector",
    "historical_boundary": "boundary-A"
  },
  "observations": [
    {
      "id": "obs-1",
      "statement": "Material evidence is alleged to be excluded because it weakens the desired historical result.",
      "evidence_refs": [
        "ev-1"
      ]
    }
  ],
  "evidence": [
    {
      "id": "ev-1",
      "kind": "SELF_CONTAINED",
      "description": "Illustrative submitter-provided evidence description for format testing."
    }
  ],
  "counterexample": {
    "reasoning": "If the exclusion follows the desired result rather than the declared admission rule, C04-F5 is implicated."
  },
  "notes": "Illustrative fixture. Mechanical well-formedness is not substantive adjudication."
}
